{
  "$schema": "../../../schemas/recipe.schema.json",
  "title": { "en": "Dutch bacon pancakes", "nl": "Spekpannenkoeken" },
  "summary": {
    "en": "Big, thin Dutch pancakes with crisp bacon baked right into the batter. Eat them rolled up with a drizzle of syrup.",
    "nl": "Grote, dunne pannenkoeken met knapperig spek in het beslag gebakken. Opgerold eten, met een flinke streep stroop."
  },
  "servings": 4,
  "prepMinutes": 40,
  "cookMinutes": 30,
  "tags": [
    { "en": "Dutch classic", "nl": "Hollands klassiek" },
    { "en": "weekend", "nl": "weekend" }
  ],
  "cover": {
    "file": "cover.jpg",
    "alt": {
      "en": "A large thin pancake with strips of bacon baked into it, on a white plate with a knife and fork.",
      "nl": "Een grote dunne pannenkoek met reepjes spek erin gebakken, op een wit bord met mes en vork."
    },
    "credit": {
      "author": "Takeaway",
      "license": "CC BY-SA 4.0",
      "source": "https://commons.wikimedia.org/wiki/File:2015_01_Spekpannenkoek.jpg"
    }
  },
  "ingredients": [
    { "id": "flour", "name": { "en": "plain flour", "nl": "bloem" }, "amount": 250, "unit": "g" },
    { "id": "salt", "name": { "en": "salt", "nl": "zout" }, "amount": 1, "unit": "pinch" },
    { "id": "eggs", "name": { "en": "eggs", "nl": "eieren" }, "amount": 2, "unit": "piece" },
    { "id": "milk", "name": { "en": "whole milk", "nl": "volle melk" }, "amount": 500, "unit": "ml" },
    { "id": "butter", "name": { "en": "butter, for frying", "nl": "boter, om te bakken" }, "amount": 40, "unit": "g" },
    { "id": "bacon", "name": { "en": "thin bacon", "nl": "ontbijtspek" }, "amount": 16, "unit": "slice" },
    { "id": "syrup", "name": { "en": "pancake syrup", "nl": "stroop" } },
    { "id": "icing-sugar", "name": { "en": "icing sugar", "nl": "poedersuiker" } }
  ],
  "prep": [
    {
      "text": {
        "en": "Weigh the flour into a large bowl, add the salt and make a well in the middle.",
        "nl": "Weeg de bloem af in een grote kom, voeg het zout toe en maak een kuiltje in het midden."
      },
      "ingredients": ["flour", "salt"]
    },
    {
      "text": {
        "en": "Crack the eggs into the well, add a third of the milk and whisk from the middle out into a thick, smooth batter. Then whisk in the rest of the milk.",
        "nl": "Breek de eieren in het kuiltje, voeg een derde van de melk toe en klop vanuit het midden tot een dik, glad beslag. Klop daarna de rest van de melk erdoor."
      },
      "ingredients": ["eggs", "milk"],
      "tip": {
        "en": "Adding the milk bit by bit is what keeps the lumps away.",
        "nl": "De melk beetje bij beetje toevoegen is wat de klontjes voorkomt."
      }
    },
    {
      "text": {
        "en": "Cover the bowl and let the batter rest, so the pancakes come out soft and tender.",
        "nl": "Dek de kom af en laat het beslag rusten, dan worden de pannenkoeken zacht en mals."
      },
      "timer": { "minutes": 30, "label": { "en": "Rest the batter", "nl": "Beslag laten rusten" } }
    },
    {
      "text": {
        "en": "Lay out the bacon on a plate, two slices per pancake. Put the butter on a saucer with a knife, and heat the oven to 70 °C with a plate inside for the finished pancakes.",
        "nl": "Leg het spek klaar op een bord, twee plakjes per pannenkoek. Zet de boter met een mes op een schoteltje en verwarm de oven op 70 °C met een bord erin voor de gebakken pannenkoeken."
      },
      "ingredients": ["bacon", "butter"]
    },
    {
      "text": {
        "en": "Put the syrup and icing sugar on the table.",
        "nl": "Zet de stroop en poedersuiker op tafel."
      },
      "ingredients": ["syrup", "icing-sugar"]
    }
  ],
  "cook": [
    {
      "text": {
        "en": "Heat a 24 to 28 cm frying pan over medium-high heat and melt a small knob of butter in it.",
        "nl": "Verhit een koekenpan van 24 tot 28 cm op middelhoog vuur en smelt er een klein klontje boter in."
      },
      "ingredients": ["butter"]
    },
    {
      "text": {
        "en": "Lay two slices of bacon in the pan and fry until they start to crisp.",
        "nl": "Leg twee plakjes spek in de pan en bak ze tot ze knapperig beginnen te worden."
      },
      "ingredients": ["bacon"],
      "timer": { "minutes": 2, "label": { "en": "Crisp the bacon", "nl": "Spek uitbakken" } }
    },
    {
      "text": {
        "en": "Pour a ladle of batter over the bacon and tilt the pan so it covers the bottom thinly. Bake until the top looks dry.",
        "nl": "Schep een soeplepel beslag over het spek en kantel de pan zodat de bodem dun bedekt is. Bak tot de bovenkant droog lijkt."
      },
      "timer": { "minutes": 2, "label": { "en": "First side", "nl": "Eerste kant" } },
      "tip": {
        "en": "The first pancake is always a test. Turn the heat up or down after it.",
        "nl": "De eerste pannenkoek is altijd een proefje. Zet het vuur daarna hoger of lager."
      },
      "image": {
        "file": "flip.jpg",
        "alt": {
          "en": "A thin layer of pancake batter setting in a dark non-stick pan.",
          "nl": "Een dunne laag pannenkoekbeslag die stolt in een donkere koekenpan."
        },
        "credit": {
          "author": "Shisma",
          "license": "CC BY 4.0",
          "source": "https://commons.wikimedia.org/wiki/File:Pancake_on_pan.jpg"
        }
      }
    },
    {
      "text": {
        "en": "Flip the pancake with a wide spatula and bake the other side golden.",
        "nl": "Keer de pannenkoek met een brede spatel en bak de andere kant goudbruin."
      },
      "timer": { "minutes": 1, "label": { "en": "Second side", "nl": "Tweede kant" } }
    },
    {
      "text": {
        "en": "Slide it onto the plate in the oven and repeat with the rest of the bacon and batter. Serve with syrup and icing sugar.",
        "nl": "Laat hem op het bord in de oven glijden en herhaal met de rest van het spek en beslag. Serveer met stroop en poedersuiker."
      },
      "ingredients": ["bacon", "syrup", "icing-sugar"]
    }
  ]
}
